{
  "schema": "CDF_CONFIG_SM_ANSA_V1",
  "seed": 20260506,
  "unit": "mm",
  "num_samples": 64,
  "dataset_profile": "sm_entity_v2_compact",
  "global_mesh_policy": {
    "h0_mm": 3.0,
    "h_min_mm": 0.5,
    "h_max_mm": 8.0,
    "growth_rate": 1.25,
    "quality_profile": "AMG_QA_SHELL_V2"
  },
  "part_sampling": {
    "part_cases": [
      "flat_hole",
      "flat_slot",
      "flat_cutout",
      "flat_combo",
      "single_flange",
      "l_bracket",
      "u_channel",
      "hat_channel"
    ]
  },
  "validation": {
    "require_clean_constant_thickness_cad": true,
    "graph_target_leakage_forbidden": true
  },
  "ansa_oracle": {
    "enabled": true,
    "ansa_executable": "${ANSA_EXECUTABLE}",
    "size_field_batch_script": "cad_dataset_factory/cdf/oracle/ansa_scripts/cdf_ansa_size_field.py",
    "quality_profile": "AMG_QA_SHELL_V2",
    "solver_deck": "NASTRAN",
    "timeout_sec_per_sample": 180
  }
}
